{
    "$schema": "http://json-schema.org/draft-07/schema#",
    "$id": "build-config.schema.json",
    "title": "Pridemoji build configuration",
    "description": "The Pridemoji build configuration.",
    "type": "object",
    "properties": {
        "static": {
            "description": "A list of static svg files to render.",
            "type": "array",
            "items": {
                "description": "The path to an SVG file. Allows wildcards.",
                "type": "string"
            }
        },
        "combinations": {
            "description": "A list of emoji combinations to generate.",
            "type": "array",
            "items": {
                "description": "An emoji combination to generate.",
                "type": "object",
                "properties": {
                    "templates": {
                        "description": "A list of the emoji templates to use, or a wildcard to include all templates.",
                        "oneOf": [
                            {
                                "type": "string",
                                "const": "*"
                            },
                            {
                                "type": "array",
                                "items": {
                                    "$ref": "#/definitions/identifier"
                                }
                            }
                        ]
                    },
                    "prides": {
                        "description": "A list of pride colors to use, or a wildcard to include all prides.",
                        "oneOf": [
                            {
                                "type": "string",
                                "const": "*"
                            },
                            {
                                "type": "array",
                                "items": {
                                    "$ref": "#/definitions/identifier"
                                }
                            }
                        ]
                    }
                },
                "additionalProperties": false,
                "required": [
                    "templates",
                    "prides"
                ]
            }
        },
        "templates": {
            "description": "A map of emoji templates.",
            "type": "object",
            "patternProperties": {
                "^[a-zA-Z-]+$": {
                    "description": "An emoji template.",
                    "type": "object",
                    "properties": {
                        "name": {
                            "description": "The full name of the template.",
                            "type": "string"
                        },
                        "templateFile": {
                            "description": "A path to the SVG template file.",
                            "type": "string"
                        },
                        "stripesId": {
                            "description": "The id of the element to draw stripes inside.",
                            "type": "string"
                        },
                        "stripesRotation": {
                            "description": "The angle the stripes should be drawn at.",
                            "type": "integer"
                        },
                        "accentIds": {
                            "description": "An array of accent containers to use for accent colors.",
                            "type": "array",
                            "items": {
                                "description": "The id of the accent element.",
                                "type": "string"
                            }
                        }
                    },
                    "required": [
                        "name",
                        "templateFile",
                        "stripesId"
                    ],
                    "additionalProperties": false
                }
            },
            "additionalProperties": false
        },
        "prides": {
            "description": "A map of pride colors.",
            "type": "object",
            "patternProperties": {
                "^[a-zA-Z-]+$": {
                    "type": "object",
                    "description": "A pride",
                    "properties": {
                        "name": {
                            "description": "The full name of the pride.",
                            "type": "string"
                        },
                        "stripes": {
                            "description": "The pride's stripe colors.",
                            "type": "array",
                            "items": {
                                "description": "The hexidecimal color of the stripe.",
                                "type": "string",
                                "format": "color-hex"
                            }
                        },
                        "accents": {
                            "description": "The pride accents. Defaults to the first stripe color.",
                            "type": "object",
                            "patternProperties": {
                                "^[a-zA-Z-]+$": {
                                    "description": "The hexidecimal accent color.",
                                    "type": "string",
                                    "format": "color-hex"
                                }
                            }
                        },
                        "variants": {
                            "description": "A map of color variations for a pride.",
                            "type": "object",
                            "patternProperties": {
                                "^[a-zA-Z-]+$": {
                                    "type": "object",
                                    "description": "A pride",
                                    "properties": {
                                        "name": {
                                            "description": "The full name of the pride.",
                                            "type": "string"
                                        },
                                        "stripes": {
                                            "description": "The pride stripes.",
                                            "type": "array",
                                            "items": {
                                                "description": "The pride stripe color.",
                                                "type": "string",
                                                "format": "color-hex"
                                            }
                                        },
                                        "accents": {
                                            "description": "The pride accents. Defaults to the first stripe color.",
                                            "type": "object",
                                            "patternProperties": {
                                                "^[a-zA-Z-]+$": {
                                                    "description": "The hexidecimal accent color.",
                                                    "type": "string",
                                                    "format": "color-hex"
                                                }
                                            }
                                        }
                                    },
                                    "required": [
                                        "name"
                                    ],
                                    "additionalProperties": false
                                }
                            },
                            "additionalProperties": false
                        }
                    },
                    "required": [
                        "name",
                        "stripes"
                    ],
                    "additionalProperties": false
                },
                "uniqueItems": true
            }
        }
    },
    "required": [
        "combinations",
        "templates",
        "prides"
    ],
    "additionalProperties": false,
    "definitions": {
        "identifier": {
            "type": "string",
            "pattern": "^[a-zA-Z-]+$"
        }
    }
}
